[
  {
    "insight_id": "i01",
    "match_id": "m001",
    "period": 1,
    "minute": 1,
    "second": 44,
    "t_s": 104,
    "type": "card_upgrade",
    "priority": 0.6,
    "players": [
      "S. Leyva"
    ],
    "team": "Real Cardón",
    "facts": {
      "player": "S. Leyva",
      "attribute": "disparo",
      "from": 80,
      "to": 81,
      "delta": 1,
      "reason": "remate a 115 km/h",
      "reason_code": "shot_speed",
      "reason_params": {
        "speed_kmh": 115
      },
      "overall_from": 65,
      "overall_to": 65,
      "shot_speed_kmh": 115.3
    },
    "evidence": [
      30
    ]
  },
  {
    "insight_id": "i02",
    "match_id": "m001",
    "period": 1,
    "minute": 1,
    "second": 44,
    "t_s": 104,
    "type": "card_upgrade",
    "priority": 0.6,
    "players": [
      "K. Rosas"
    ],
    "team": "Real Cardón",
    "facts": {
      "player": "K. Rosas",
      "attribute": "fisico",
      "from": 64,
      "to": 65,
      "delta": 1,
      "reason": "recuperación en campo propio que terminó en remate en 10 segundos",
      "reason_code": "recovery_to_shot",
      "reason_params": {
        "seconds": 10,
        "shooter": "S. Leyva"
      },
      "overall_from": 69,
      "overall_to": 70
    },
    "evidence": [
      27,
      30
    ]
  },
  {
    "insight_id": "i03",
    "match_id": "m001",
    "period": 1,
    "minute": 3,
    "second": 33,
    "t_s": 213,
    "type": "duel_state",
    "priority": 0.37,
    "players": [
      "P. Lugo",
      "L. Montaño"
    ],
    "team": null,
    "facts": {
      "player_a": "P. Lugo",
      "player_b": "L. Montaño",
      "bar": 0.11,
      "a_vs_role": 0.08,
      "b_vs_role": -0.15,
      "duels_won_a": 1,
      "duels_won_b": 0,
      "direct_duels": 1,
      "chances_created_a": 0,
      "chances_created_b": 0,
      "flipped": false
    },
    "evidence": [
      60
    ]
  },
  {
    "insight_id": "i04",
    "match_id": "m001",
    "period": 1,
    "minute": 6,
    "second": 9,
    "t_s": 369,
    "type": "duel_state",
    "priority": 0.37,
    "players": [
      "A. Olvera",
      "N. Ruelas"
    ],
    "team": null,
    "facts": {
      "player_a": "A. Olvera",
      "player_b": "N. Ruelas",
      "bar": -0.12,
      "a_vs_role": -0.01,
      "b_vs_role": 0.22,
      "duels_won_a": 1,
      "duels_won_b": 0,
      "direct_duels": 1,
      "chances_created_a": 0,
      "chances_created_b": 0,
      "flipped": false
    },
    "evidence": [
      107,
      109,
      110,
      111
    ]
  },
  {
    "insight_id": "i05",
    "match_id": "m001",
    "period": 1,
    "minute": 6,
    "second": 28,
    "t_s": 388,
    "type": "card_upgrade",
    "priority": 0.6,
    "players": [
      "K. Rosas"
    ],
    "team": "Real Cardón",
    "facts": {
      "player": "K. Rosas",
      "attribute": "ritmo",
      "from": 70,
      "to": 71,
      "delta": 1,
      "reason": "desmarque a 31 km/h",
      "reason_code": "run_speed",
      "reason_params": {
        "speed_kmh": 31
      },
      "overall_from": 70,
      "overall_to": 70,
      "run_speed_kmh": 31.3
    },
    "evidence": [
      117
    ]
  },
  {
    "insight_id": "i06",
    "match_id": "m001",
    "period": 1,
    "minute": 7,
    "second": 45,
    "t_s": 465,
    "type": "team_phase",
    "priority": 0.55,
    "players": [
      "F. Cota",
      "R. Salgado",
      "O. Félix"
    ],
    "team": "Bahía FC",
    "facts": {
      "label": "possession_spell",
      "window": "06:46-07:34",
      "passes": 13,
      "duration_s": 48,
      "players_involved": 7,
      "ended_in": "out"
    },
    "evidence": [
      123,
      125,
      126,
      127,
      128,
      129,
      130,
      131,
      132,
      133,
      134,
      135,
      136
    ]
  },
  {
    "insight_id": "i07",
    "match_id": "m001",
    "period": 1,
    "minute": 9,
    "second": 26,
    "t_s": 566,
    "type": "team_phase",
    "priority": 0.55,
    "players": [
      "E. Sandoval",
      "B. Haro",
      "T. Esquer"
    ],
    "team": "Real Cardón",
    "facts": {
      "label": "possession_spell",
      "window": "08:41-09:22",
      "passes": 12,
      "duration_s": 41,
      "players_involved": 6,
      "ended_in": "shot"
    },
    "evidence": [
      154,
      155,
      156,
      158,
      159,
      160,
      161,
      162,
      163,
      164,
      165,
      166
    ]
  },
  {
    "insight_id": "i08",
    "match_id": "m001",
    "period": 1,
    "minute": 10,
    "second": 23,
    "t_s": 623,
    "type": "mvp_rank_change",
    "priority": 0.49,
    "players": [
      "P. Lugo"
    ],
    "team": "Bahía FC",
    "facts": {
      "player": "P. Lugo",
      "from_rank": 3,
      "to_rank": 2,
      "mvp_score": 2.1,
      "trigger_event_id": 193,
      "leader": "J. Torres",
      "stats": {
        "recoveries": 2,
        "duels_won": 1,
        "progressive_passes": 2
      },
      "expected_for_role": {
        "duels_won": 0.4,
        "recoveries": 0.58,
        "progressive_passes": 0.98,
        "key_passes": 0.0
      },
      "ranking": [
        {
          "rank": 1,
          "player": "J. Torres",
          "team": "Bahía FC",
          "position": "ED",
          "mvp_score": 2.2
        },
        {
          "rank": 2,
          "player": "P. Lugo",
          "team": "Bahía FC",
          "position": "LI",
          "mvp_score": 2.1
        },
        {
          "rank": 3,
          "player": "R. Salgado",
          "team": "Bahía FC",
          "position": "MC",
          "mvp_score": 2.0
        },
        {
          "rank": 4,
          "player": "M. Ramírez",
          "team": "Bahía FC",
          "position": "DC",
          "mvp_score": 1.6
        },
        {
          "rank": 5,
          "player": "K. Rosas",
          "team": "Real Cardón",
          "position": "MC",
          "mvp_score": 1.6
        }
      ]
    },
    "evidence": [
      61,
      140,
      185,
      193
    ]
  },
  {
    "insight_id": "i09",
    "match_id": "m001",
    "period": 1,
    "minute": 11,
    "second": 40,
    "t_s": 700,
    "type": "duel_state",
    "priority": 0.38,
    "players": [
      "J. Torres",
      "B. Haro"
    ],
    "team": null,
    "facts": {
      "player_a": "J. Torres",
      "player_b": "B. Haro",
      "bar": 0.17,
      "a_vs_role": 0.51,
      "b_vs_role": 0.18,
      "duels_won_a": 0,
      "duels_won_b": 1,
      "direct_duels": 1,
      "chances_created_a": 1,
      "chances_created_b": 0,
      "flipped": false
    },
    "evidence": [
      215
    ]
  },
  {
    "insight_id": "i10",
    "match_id": "m001",
    "period": 1,
    "minute": 14,
    "second": 21,
    "t_s": 861,
    "type": "mvp_rank_change",
    "priority": 0.49,
    "players": [
      "O. Félix"
    ],
    "team": "Bahía FC",
    "facts": {
      "player": "O. Félix",
      "from_rank": 4,
      "to_rank": 3,
      "mvp_score": 2.8,
      "trigger_event_id": 265,
      "leader": "P. Lugo",
      "stats": {
        "recoveries": 2,
        "duels_won": 1,
        "key_passes": 1,
        "progressive_passes": 3
      },
      "expected_for_role": {
        "duels_won": 0.88,
        "recoveries": 1.2,
        "progressive_passes": 1.99,
        "key_passes": 0.08
      },
      "ranking": [
        {
          "rank": 1,
          "player": "P. Lugo",
          "team": "Bahía FC",
          "position": "LI",
          "mvp_score": 3.1
        },
        {
          "rank": 2,
          "player": "R. Salgado",
          "team": "Bahía FC",
          "position": "MC",
          "mvp_score": 2.8
        },
        {
          "rank": 3,
          "player": "O. Félix",
          "team": "Bahía FC",
          "position": "MC",
          "mvp_score": 2.8
        },
        {
          "rank": 4,
          "player": "M. Ramírez",
          "team": "Bahía FC",
          "position": "DC",
          "mvp_score": 2.7
        },
        {
          "rank": 5,
          "player": "K. Rosas",
          "team": "Real Cardón",
          "position": "MC",
          "mvp_score": 2.1
        }
      ]
    },
    "evidence": [
      181,
      256,
      265
    ]
  },
  {
    "insight_id": "i11",
    "match_id": "m001",
    "period": 1,
    "minute": 15,
    "second": 11,
    "t_s": 911,
    "type": "card_upgrade",
    "priority": 0.6,
    "players": [
      "S. Beltrán"
    ],
    "team": "Bahía FC",
    "facts": {
      "player": "S. Beltrán",
      "attribute": "fisico",
      "from": 78,
      "to": 79,
      "delta": 1,
      "reason": "recuperación en campo propio que terminó en remate en 9 segundos",
      "reason_code": "recovery_to_shot",
      "reason_params": {
        "seconds": 9,
        "shooter": "A. Olvera"
      },
      "overall_from": 60,
      "overall_to": 60
    },
    "evidence": [
      278,
      280
    ]
  },
  {
    "insight_id": "i12",
    "match_id": "m001",
    "period": 1,
    "minute": 19,
    "second": 1,
    "t_s": 1141,
    "type": "card_upgrade",
    "priority": 0.6,
    "players": [
      "K. Rosas"
    ],
    "team": "Real Cardón",
    "facts": {
      "player": "K. Rosas",
      "attribute": "ritmo",
      "from": 71,
      "to": 72,
      "delta": 1,
      "reason": "desmarque a 32 km/h",
      "reason_code": "run_speed",
      "reason_params": {
        "speed_kmh": 32
      },
      "overall_from": 70,
      "overall_to": 70,
      "run_speed_kmh": 32.4
    },
    "evidence": [
      344
    ]
  },
  {
    "insight_id": "i13",
    "match_id": "m001",
    "period": 1,
    "minute": 19,
    "second": 39,
    "t_s": 1179,
    "type": "mvp_rank_change",
    "priority": 0.69,
    "players": [
      "E. Sandoval"
    ],
    "team": "Real Cardón",
    "facts": {
      "player": "E. Sandoval",
      "from_rank": 8,
      "to_rank": 2,
      "mvp_score": 3.2,
      "trigger_event_id": 357,
      "leader": "R. Salgado",
      "stats": {
        "recoveries": 3,
        "recoveries_opp_half": 1,
        "duels_won": 1,
        "key_passes": 1,